CO226 - Database Systems
Lab-05
E/16/203
Lakshan S.A.I




///////////***********************************************(01)*************************************************\\\\\\\\\\

A).
mysql> select * from movie where Director in (select ReviewerName from reviewer);
+---------+---------+------+---------------+
| MovieID | Title   | Year | Director      |
+---------+---------+------+---------------+
| 105     | Titanic | 1997 | James Cameron |
| 107     | Avatar  | 2009 | James Cameron |
+---------+---------+------+---------------+
2 rows in set (0.00 sec)

B).
mysql> select * from movie where Director not in (select ReviewerName from reviewer);
+---------+-------------------------+------+------------------+
| MovieID | Title                   | Year | Director         |
+---------+-------------------------+------+------------------+
| 101     | Gone with the Wind      | 1939 | Victor Fleming   |
| 102     | Star Wars               | 1977 | George Lucas     |
| 103     | The Sound of Music      | 1965 | Robert Wise      |
| 104     | E.T.                    | 1982 | Steven Spielberg |
| 108     | Raiders of the Lost Ark | 1981 | Steven Spielberg |
+---------+-------------------------+------+------------------+
5 rows in set (0.00 sec)



///////////***********************************************(02)*************************************************\\\\\\\\\\

A).
mysql> select * from rating where ReviewerID = (select ReviewerID from reviewer where ReviewerName = 'Sarah Martinez');
+------------+---------+-------+------------+
| ReviewerID | MovieID | Stars | RatingDate |
+------------+---------+-------+------------+
| 201        | 101     |     2 | 2011-01-22 |
| 201        | 101     |     4 | 2011-01-27 |
+------------+---------+-------+------------+
2 rows in set (0.02 sec)

B).
mysql> select * from rating where ReviewerID != (select ReviewerID from reviewer where ReviewerName = 'Sarah Martinez');
+------------+---------+-------+------------+
| ReviewerID | MovieID | Stars | RatingDate |
+------------+---------+-------+------------+
| 202        | 106     |     4 | NULL       |
| 203        | 103     |     2 | 2011-01-20 |
| 203        | 108     |     4 | 2011-01-12 |
| 203        | 108     |     2 | 2011-01-30 |
| 204        | 101     |     3 | 2011-01-09 |
| 205        | 103     |     3 | 2011-01-27 |
| 205        | 104     |     2 | 2011-01-22 |
| 205        | 108     |     4 | NULL       |
| 206        | 107     |     3 | 2011-01-15 |
| 206        | 106     |     5 | 2011-01-19 |
| 207        | 107     |     5 | 2011-01-20 |
| 208        | 104     |     3 | 2011-01-02 |
+------------+---------+-------+------------+
12 rows in set (0.00 sec)


///////////***********************************************(03)*************************************************\\\\\\\\\\

A).
mysql> select MovieID from rating where Stars < any (select Stars from rating where MovieID = 103);
+---------+
| MovieID |
+---------+
| 101     |
| 103     |
| 108     |
| 104     |
+---------+
4 rows in set (0.00 sec)

B).
mysql> select MovieID from rating where Stars <= any (select Stars from rating where MovieID = 103);
+---------+
| MovieID |
+---------+
| 101     |
| 103     |
| 108     |
| 101     |
| 103     |
| 104     |
| 107     |
| 104     |
+---------+
8 rows in set (0.00 sec)

C).
mysql> select MovieID from rating where Stars = any (select Stars from rating where MovieID = 103);
+---------+
| MovieID |
+---------+
| 101     |
| 103     |
| 108     |
| 104     |
| 101     |
| 103     |
| 107     |
| 104     |
+---------+
8 rows in set (0.00 sec)

D).
mysql> select MovieID from rating where Stars > any (select Stars from rating where MovieID = 103);
+---------+
| MovieID |
+---------+
| 101     |
| 106     |
| 108     |
| 101     |
| 103     |
| 108     |
| 107     |
| 106     |
| 107     |
| 104     |
+---------+
10 rows in set (0.00 sec)

E).
mysql> select MovieID from rating where Stars >= any (select Stars from rating where MovieID = 103);
+---------+
| MovieID |
+---------+
| 101     |
| 101     |
| 106     |
| 103     |
| 108     |
| 108     |
| 101     |
| 103     |
| 104     |
| 108     |
| 107     |
| 106     |
| 107     |
| 104     |
+---------+
14 rows in set (0.00 sec)

F).
mysql> select MovieID from rating where Stars != any (select Stars from rating where MovieID = 103);
+---------+
| MovieID |
+---------+
| 101     |
| 101     |
| 106     |
| 103     |
| 108     |
| 108     |
| 101     |
| 103     |
| 104     |
| 108     |
| 107     |
| 106     |
| 107     |
| 104     |
+---------+
14 rows in set (0.00 sec)


///////////***********************************************(04)*************************************************\\\\\\\\\\

mysql> select ReviewerID from rating where MovieID = (select MovieID from rating where RatingDate = '2011-01-12') and stars = (select stars from rating where RatingDate = '2011-01-12');
+------------+
| ReviewerID |
+------------+
| 203        |
| 205        |
+------------+
2 rows in set (0.02 sec)


///////////***********************************************(05)*************************************************\\\\\\\\\\

A).
mysql> select Year from movie where MovieID = any (select MovieID from rating where Stars = 4 or Stars = 5);
+------+
| Year |
+------+
| 1939 |
| 1937 |
| 1981 |
| 2009 |
+------+
4 rows in set (0.00 sec)

B).
mysql> select Year from movie,rating where movie.MovieID = rating.MovieID AND (rating.Stars = 4 OR rating.Stars = 5);
+------+
| Year |
+------+
| 1939 |
| 1937 |
| 1981 |
| 1981 |
| 1937 |
| 2009 |
+------+
6 rows in set (0.00 sec)

C).
mysql> select Year from movie,rating where movie.MovieID = rating.MovieID AND (rating.Stars = 4 OR rating.Stars = 5) group by Year;
+------+
| Year |
+------+
| 1939 |
| 1937 |
| 1981 |
| 2009 |
+------+
4 rows in set (0.00 sec)



///////////***********************************************(06)*************************************************\\\\\\\\\\

A).
mysql> select Title from movie where MovieID != all (select MovieID from rating where movie.MovieID = rating.MovieID);
+-----------+
| Title     |
+-----------+
| Star Wars |
| Titanic   |
+-----------+
2 rows in set (0.00 sec)

B).
mysql> select Title from movie where MovieID not in (select MovieID from rating);
+-----------+
| Title     |
+-----------+
| Star Wars |
| Titanic   |
+-----------+
2 rows in set (0.03 sec)


///////////***********************************************(07)*************************************************\\\\\\\\\\

A).
select ReviewerName from reviewer,rating where reviewer.ReviewerID=rating.ReviewerID and RatingDate is NULL;
+---------------+
| ReviewerName  |
+---------------+
| Daniel Lewis  |
| Chris Jackson |
+---------------+
2 rows in set (0.00 sec)

B).
 select ReviewerName from reviewer where ReviewerID = any (select ReviewerID from rating where RatingDate is NULL);
+---------------+
| ReviewerName  |
+---------------+
| Daniel Lewis  |
| Chris Jackson |
+---------------+
2 rows in set (0.00 sec)

C).
select ReviewerName from reviewer where ReviewerID = any (select ReviewerID from rating,movie where rating.MovieID = movie.MovieID and RatingDate is NULL);
+---------------+
| ReviewerName  |
+---------------+
| Daniel Lewis  |
| Chris Jackson |
+---------------+
2 rows in set (0.00 sec)





///////////***********************************************(08)*************************************************\\\\\\\\\\

A).
select Title,max(Stars) from movie,rating where movie.MovieID=rating.MovieID group by Title order by Title ASC;
+-------------------------+------------+
| Title                   | max(Stars) |
+-------------------------+------------+
| Avatar                  |          5 |
| E.T.                    |          3 |
| Gone with the Wind      |          4 |
| Raiders of the Lost Ark |          4 |
| Snow White              |          5 |
| The Sound of Music      |          3 |
+-------------------------+------------+
6 rows in set (0.02 sec)

B).
mysql> select Title,min(Stars) from movie,rating where movie.MovieID=rating.MovieID group by Title order by Title ASC;
+-------------------------+------------+
| Title                   | min(Stars) |
+-------------------------+------------+
| Avatar                  |          3 |
| E.T.                    |          2 |
| Gone with the Wind      |          2 |
| Raiders of the Lost Ark |          2 |
| Snow White              |          4 |
| The Sound of Music      |          2 |
+-------------------------+------------+
6 rows in set (0.00 sec)

C).
mysql> select Title,avg(Stars) from movie,rating where movie.MovieID=rating.MovieID group by Title order by Title ASC;
+-------------------------+------------+
| Title                   | avg(Stars) |
+-------------------------+------------+
| Avatar                  |     4.0000 |
| E.T.                    |     2.5000 |
| Gone with the Wind      |     3.0000 |
| Raiders of the Lost Ark |     3.3333 |
| Snow White              |     4.5000 |
| The Sound of Music      |     2.5000 |
+-------------------------+------------+
6 rows in set (0.00 sec)

D).
mysql> select Title,sum(Stars) from movie,rating where movie.MovieID=rating.MovieID group by Title order by Title ASC;
+-------------------------+------------+
| Title                   | sum(Stars) |
+-------------------------+------------+
| Avatar                  |          8 |
| E.T.                    |          5 |
| Gone with the Wind      |          9 |
| Raiders of the Lost Ark |         10 |
| Snow White              |          9 |
| The Sound of Music      |          5 |
+-------------------------+------------+
6 rows in set (0.00 sec)

E).
mysql> select Title,count(Title) from movie,rating where movie.MovieID=rating.MovieID group by Title order by Title ASC;
+-------------------------+--------------+
| Title                   | count(Title) |
+-------------------------+--------------+
| Avatar                  |            2 |
| E.T.                    |            2 |
| Gone with the Wind      |            3 |
| Raiders of the Lost Ark |            3 |
| Snow White              |            2 |
| The Sound of Music      |            2 |
+-------------------------+--------------+
6 rows in set (0.00 sec)



///////////***********************************************(09)*************************************************\\\\\\\\\\

A).
mysql> select ReviewerName from reviewer,rating where reviewer.ReviewerID = rating.ReviewerID group by ReviewerName having count(*)>=3;
+-----------------+
| ReviewerName    |
+-----------------+
| Brittany Harris |
| Chris Jackson   |
+-----------------+
2 rows in set (0.03 sec)

B).
mysql> select ReviewerName from reviewer where ReviewerID = any (select ReviewerID from rating group by ReviewerID having count(ReviewerID)>=3);
+-----------------+
| ReviewerName    |
+-----------------+
| Brittany Harris |
| Chris Jackson   |
+-----------------+
2 rows in set (0.00 sec)

C).
mysql> select ReviewerName from reviewer where (select count(ReviewerID) from rating where reviewer.ReviewerID = rating.ReviewerID) >=3;
+-----------------+
| ReviewerName    |
+-----------------+
| Brittany Harris |
| Chris Jackson   |
+-----------------+
2 rows in set (0.00 sec)



///////////***********************************************(10)*************************************************\\\\\\\\\\

mysql> select Title,avg(Stars) from movie,rating where movie.MovieID = rating.MovieID group by Title order by avg(Stars) DESC,Title;
+-------------------------+------------+
| Title                   | avg(Stars) |
+-------------------------+------------+
| Snow White              |     4.5000 |
| Avatar                  |     4.0000 |
| Raiders of the Lost Ark |     3.3333 |
| Gone with the Wind      |     3.0000 |
| E.T.                    |     2.5000 |
| The Sound of Music      |     2.5000 |
+-------------------------+------------+
6 rows in set (0.00 sec)



///////////***********************************************(11)*************************************************\\\\\\\\\\

mysql> delete from rating where MovieID = any (select MovieID from movie where Year<1970 or Year>2000);
Query OK, 9 rows affected (0.02 sec)

mysql> select * from rating;
+------------+---------+-------+------------+
| ReviewerID | MovieID | Stars | RatingDate |
+------------+---------+-------+------------+
| 203        | 108     |     4 | 2011-01-12 |
| 203        | 108     |     2 | 2011-01-30 |
| 205        | 104     |     2 | 2011-01-22 |
| 205        | 108     |     4 | NULL       |
| 208        | 104     |     3 | 2011-01-02 |
+------------+---------+-------+------------+
5 rows in set (0.00 sec)




///////////***********************************************(12)*************************************************\\\\\\\\\\

mysql> delete from rating where RatingDate is NULL;
Query OK, 1 row affected (0.02 sec)

mysql> select * from rating;
+------------+---------+-------+------------+
| ReviewerID | MovieID | Stars | RatingDate |
+------------+---------+-------+------------+
| 203        | 108     |     4 | 2011-01-12 |
| 203        | 108     |     2 | 2011-01-30 |
| 205        | 104     |     2 | 2011-01-22 |
| 208        | 104     |     3 | 2011-01-02 |
+------------+---------+-------+------------+
4 rows in set (0.00 sec)




///////////***********************************************(13)*************************************************\\\\\\\\\\

mysql> insert into rating (ReviewerID,MovieID) select ReviewerID,MovieID from reviewer,movie where ReviewerName = 'James Cameron';
Query OK, 8 rows affected (0.02 sec)
Records: 8  Duplicates: 0  Warnings: 0

mysql> update rating set Stars = 5 where ReviewerID = (select ReviewerID from reviewer where ReviewerName = 'James Cameron');
Query OK, 8 rows affected (0.02 sec)
Rows matched: 8  Changed: 8  Warnings: 0

mysql> select * from rating;
+------------+---------+-------+------------+
| ReviewerID | MovieID | Stars | RatingDate |
+------------+---------+-------+------------+
| 203        | 108     |     4 | 2011-01-12 |
| 203        | 108     |     2 | 2011-01-30 |
| 205        | 104     |     2 | 2011-01-22 |
| 208        | 104     |     3 | 2011-01-02 |
| 207        | 101     |     5 | NULL       |
| 207        | 102     |     5 | NULL       |
| 207        | 103     |     5 | NULL       |
| 207        | 104     |     5 | NULL       |
| 207        | 105     |     5 | NULL       |
| 207        | 106     |     5 | NULL       |
| 207        | 107     |     5 | NULL       |
| 207        | 108     |     5 | NULL       |
+------------+---------+-------+------------+
12 rows in set (0.00 sec)






///////////***********************************************(14)*************************************************\\\\\\\\\\

mysql> update movie set Year = Year + 25 where MovieID in (select MovieID from rating group by MovieID having avg(Stars)>=4);
Query OK, 6 rows affected (0.01 sec)
Rows matched: 6  Changed: 6  Warnings: 0

mysql> select * from movie;
+---------+-------------------------+------+------------------+
| MovieID | Title                   | Year | Director         |
+---------+-------------------------+------+------------------+
| 101     | Gone with the Wind      | 1964 | Victor Fleming   |
| 102     | Star Wars               | 2002 | George Lucas     |
| 103     | The Sound of Music      | 1990 | Robert Wise      |
| 104     | E.T.                    | 1982 | Steven Spielberg |
| 105     | Titanic                 | 2022 | James Cameron    |
| 106     | Snow White              | 1962 | NULL             |
| 107     | Avatar                  | 2034 | James Cameron    |
| 108     | Raiders of the Lost Ark | 1981 | Steven Spielberg |
+---------+-------------------------+------+------------------+
8 rows in set (0.00 sec)